{
  "mapId": "MP1",
  "versionId": "1",
  "sectorId": "ST23",
  "archiveInd": "N",
  "createDt": "05-11-2016 11:04:07-0400",
  "lastUpdateDt": "05-11-2016 11:04:07-0400",
  "mapDesc": "Education Map",
  "mapLastUpdateDt": "2016-05-11 11:04:07",
  "mapNm": "K-12 Education",
  "mapStatus": "Active",
  "mapTyp": "Industry",
  "usrNmLastUpd": "Dileep"
}